{
  "id": "vfx-impact-ichor",
  "notes": "Flesh impact (mw-e29.4): a stylised puff of ichor, teal with a few bright motes, never blood (style bible \u00a78: warm, gore-free).",
  "priority": 44,
  "duration": 0.6,
  "emitters": [
    {
      "id": "ichor",
      "texture": "vfx-base-smoke-noise-01",
      "blend": "alpha",
      "bursts": [
        {
          "at": 0,
          "count": 8
        }
      ],
      "lifetime": {
        "min": 0.35,
        "max": 0.6
      },
      "speed": {
        "min": 0.5,
        "max": 1.3
      },
      "coneDeg": 55,
      "spawnRadius": 0.05,
      "gravity": 0.3,
      "drag": 3,
      "size": [
        {
          "t": 0,
          "v": 0.1
        },
        {
          "t": 1,
          "v": 0.32
        }
      ],
      "color": "#4F9A8A",
      "alpha": [
        {
          "t": 0,
          "v": 0.55
        },
        {
          "t": 1,
          "v": 0
        }
      ]
    },
    {
      "id": "motes",
      "texture": "vfx-base-soft-circle-01",
      "blend": "additive",
      "bursts": [
        {
          "at": 0,
          "count": 6
        }
      ],
      "lifetime": {
        "min": 0.2,
        "max": 0.4
      },
      "speed": {
        "min": 1.5,
        "max": 3
      },
      "coneDeg": 60,
      "gravity": 3,
      "drag": 2,
      "size": 0.05,
      "color": [
        {
          "t": 0,
          "color": "#CFF5E8"
        },
        {
          "t": 1,
          "color": "#4F9A8A"
        }
      ]
    }
  ]
}
