{
  "id": "vfx-impact-critical",
  "notes": "Critical or riposte burst (mw-e29.4): a bright ring and a short spray of sparks over whatever impact the blow already made, so a punishing hit reads as one.",
  "priority": 72,
  "duration": 0.4,
  "emitters": [
    {
      "id": "ring",
      "texture": "vfx-base-ring-01",
      "blend": "additive",
      "bursts": [
        {
          "at": 0,
          "count": 1
        }
      ],
      "lifetime": {
        "min": 0.2
      },
      "size": [
        {
          "t": 0,
          "v": 0.15
        },
        {
          "t": 1,
          "v": 0.7
        }
      ],
      "color": "#FFE7A8",
      "alpha": [
        {
          "t": 0,
          "v": 0.85
        },
        {
          "t": 1,
          "v": 0
        }
      ]
    },
    {
      "id": "sparks",
      "texture": "vfx-base-spark-streak-01",
      "blend": "additive",
      "bursts": [
        {
          "at": 0,
          "count": 8
        }
      ],
      "lifetime": {
        "min": 0.15,
        "max": 0.3
      },
      "speed": {
        "min": 3,
        "max": 6
      },
      "coneDeg": 60,
      "gravity": 6,
      "drag": 2,
      "size": 0.07,
      "color": [
        {
          "t": 0,
          "color": "#FFFFFF"
        },
        {
          "t": 1,
          "color": "#FF9A3C"
        }
      ]
    }
  ]
}
