{
  "id": "vfx-impact-bone",
  "notes": "Bone impact (mw-e29.4): pale chips and a puff of bone dust when a blow lands on a skeleton. Oriented to the hit normal and scaled by the damage dealt; stylised, no gore.",
  "priority": 50,
  "duration": 0.7,
  "emitters": [
    {
      "id": "chips",
      "texture": "vfx-base-shard-01",
      "blend": "alpha",
      "bursts": [
        {
          "at": 0,
          "count": 9
        }
      ],
      "lifetime": {
        "min": 0.35,
        "max": 0.65
      },
      "speed": {
        "min": 2,
        "max": 4.5
      },
      "coneDeg": 65,
      "spawnRadius": 0.05,
      "gravity": 9.8,
      "drag": 0.8,
      "size": 0.07,
      "color": "#E5DCC5",
      "alpha": [
        {
          "t": 0,
          "v": 1
        },
        {
          "t": 0.75,
          "v": 1
        },
        {
          "t": 1,
          "v": 0
        }
      ]
    },
    {
      "id": "dust",
      "texture": "vfx-base-smoke-noise-01",
      "blend": "alpha",
      "bursts": [
        {
          "at": 0,
          "count": 7
        }
      ],
      "lifetime": {
        "min": 0.35,
        "max": 0.6
      },
      "speed": {
        "min": 0.5,
        "max": 1.3
      },
      "coneDeg": 55,
      "spawnRadius": 0.05,
      "gravity": 0.3,
      "drag": 3,
      "size": [
        {
          "t": 0,
          "v": 0.1
        },
        {
          "t": 1,
          "v": 0.3
        }
      ],
      "color": "#CFC7B0",
      "alpha": [
        {
          "t": 0,
          "v": 0.5
        },
        {
          "t": 1,
          "v": 0
        }
      ]
    }
  ]
}
