{
  "id": "vfx-impact-splinters",
  "notes": "Wood impact (mw-e29.4): a spray of pale splinters and a little dust when a blow lands on wood.",
  "priority": 48,
  "duration": 0.7,
  "emitters": [
    {
      "id": "splinters",
      "texture": "vfx-base-shard-01",
      "blend": "alpha",
      "bursts": [
        {
          "at": 0,
          "count": 10
        }
      ],
      "lifetime": {
        "min": 0.35,
        "max": 0.65
      },
      "speed": {
        "min": 2.5,
        "max": 5
      },
      "coneDeg": 50,
      "spawnRadius": 0.05,
      "gravity": 9.8,
      "drag": 0.8,
      "size": 0.08,
      "color": "#B58A55",
      "alpha": [
        {
          "t": 0,
          "v": 1
        },
        {
          "t": 0.75,
          "v": 1
        },
        {
          "t": 1,
          "v": 0
        }
      ]
    },
    {
      "id": "dust",
      "texture": "vfx-base-smoke-noise-01",
      "blend": "alpha",
      "bursts": [
        {
          "at": 0,
          "count": 4
        }
      ],
      "lifetime": {
        "min": 0.35,
        "max": 0.6
      },
      "speed": {
        "min": 0.5,
        "max": 1.3
      },
      "coneDeg": 55,
      "spawnRadius": 0.05,
      "gravity": 0.3,
      "drag": 3,
      "size": [
        {
          "t": 0,
          "v": 0.1
        },
        {
          "t": 1,
          "v": 0.3
        }
      ],
      "color": "#8A7458",
      "alpha": [
        {
          "t": 0,
          "v": 0.4
        },
        {
          "t": 1,
          "v": 0
        }
      ]
    }
  ]
}
