{
  "id": "vfx-block-wood",
  "notes": "Block on a wooden shield (mw-e29.4): wood chips and a few pale sparks off the face of the shield, so a block reads differently from a clean hit.",
  "priority": 56,
  "duration": 0.5,
  "emitters": [
    {
      "id": "chips",
      "texture": "vfx-base-shard-01",
      "blend": "alpha",
      "bursts": [
        {
          "at": 0,
          "count": 6
        }
      ],
      "lifetime": {
        "min": 0.35,
        "max": 0.65
      },
      "speed": {
        "min": 2,
        "max": 4
      },
      "coneDeg": 55,
      "spawnRadius": 0.05,
      "gravity": 9.8,
      "drag": 0.8,
      "size": 0.07,
      "color": "#B58A55",
      "alpha": [
        {
          "t": 0,
          "v": 1
        },
        {
          "t": 0.75,
          "v": 1
        },
        {
          "t": 1,
          "v": 0
        }
      ]
    },
    {
      "id": "flecks",
      "texture": "vfx-base-soft-circle-01",
      "blend": "additive",
      "bursts": [
        {
          "at": 0,
          "count": 6
        }
      ],
      "lifetime": {
        "min": 0.15,
        "max": 0.3
      },
      "speed": {
        "min": 2,
        "max": 4
      },
      "coneDeg": 50,
      "gravity": 8,
      "drag": 2,
      "size": 0.04,
      "color": [
        {
          "t": 0,
          "color": "#FFF1C9"
        },
        {
          "t": 1,
          "color": "#E0912E"
        }
      ]
    }
  ]
}
