{
  "id": "vfx-impact-stone",
  "notes": "Stone impact (mw-e29.4): grey chips and grit when a blow that is not steel lands on stone.",
  "priority": 46,
  "duration": 0.7,
  "emitters": [
    {
      "id": "chips",
      "texture": "vfx-base-shard-01",
      "blend": "alpha",
      "bursts": [
        {
          "at": 0,
          "count": 8
        }
      ],
      "lifetime": {
        "min": 0.35,
        "max": 0.65
      },
      "speed": {
        "min": 2,
        "max": 4
      },
      "coneDeg": 65,
      "spawnRadius": 0.05,
      "gravity": 9.8,
      "drag": 0.8,
      "size": 0.06,
      "color": "#8C8780",
      "alpha": [
        {
          "t": 0,
          "v": 1
        },
        {
          "t": 0.75,
          "v": 1
        },
        {
          "t": 1,
          "v": 0
        }
      ]
    },
    {
      "id": "grit",
      "texture": "vfx-base-smoke-noise-01",
      "blend": "alpha",
      "bursts": [
        {
          "at": 0,
          "count": 6
        }
      ],
      "lifetime": {
        "min": 0.35,
        "max": 0.6
      },
      "speed": {
        "min": 0.5,
        "max": 1.3
      },
      "coneDeg": 55,
      "spawnRadius": 0.05,
      "gravity": 0.3,
      "drag": 3,
      "size": [
        {
          "t": 0,
          "v": 0.1
        },
        {
          "t": 1,
          "v": 0.3
        }
      ],
      "color": "#8A857C",
      "alpha": [
        {
          "t": 0,
          "v": 0.5
        },
        {
          "t": 1,
          "v": 0
        }
      ]
    }
  ]
}
